{
  "schema_version": "1.0",
  "corpus_version": "2026.10-frozen-v2.0",
  "corpus_papers": [
    {
      "paper_id": "1706.03762_Attention_Is_All_You_Need",
      "title": "Attention Is All You Need",
      "citation": "Vaswani, A., Shazeer, N., Parmar, N., et al. (2017). Attention is all you need. In Advances in Neural Information Processing Systems (NeurIPS 2017), pp. 5998-6008.",
      "sha256": "4a12f9b8c03e8568e27c12643a6d71c89f54664871c532454b8ea162f1837a2b",
      "source_url": "https://arxiv.org/abs/1706.03762",
      "access_note": "Open access, arXiv:1706.03762v7"
    },
    {
      "paper_id": "1609.02907_GCN",
      "title": "Semi-Supervised Classification with Graph Convolutional Networks",
      "citation": "Kipf, T. N., & Welling, M. (2017). Semi-supervised classification with graph convolutional networks. In International Conference on Learning Representations (ICLR 2017).",
      "sha256": "92f7c037920ab42017ebae77d345c26922ae72147171e219e2bb97f5b1ea6102",
      "source_url": "https://arxiv.org/abs/1609.02907",
      "access_note": "Open access, arXiv:1609.02907v4"
    },
    {
      "paper_id": "1710.10903_GAT",
      "title": "Graph Attention Networks",
      "citation": "Veli\u010dkovi\u0107, P., Cucurull, G., Casanova, A., et al. (2018). Graph Attention Networks. In International Conference on Learning Representations (ICLR 2018).",
      "sha256": "8134db2fe831bca54199c099309ec9102464d26f74a817b18973d84fae726487",
      "source_url": "https://arxiv.org/abs/1710.10903",
      "access_note": "Open access, arXiv:1710.10903v3"
    },
    {
      "paper_id": "1706.02216_GraphSAGE",
      "title": "Inductive Representation Learning on Large Graphs",
      "citation": "Hamilton, W. L., Ying, R., & Leskovec, J. (2017). Inductive representation learning on large graphs. In Advances in Neural Information Processing Systems (NeurIPS 2017), pp. 1024-1034.",
      "sha256": "5c4e976db57f00d8d2128a113dcf5eb634714db28c1c4f5264b18c01aa375261",
      "source_url": "https://arxiv.org/abs/1706.02216",
      "access_note": "Open access, arXiv:1706.02216v4"
    },
    {
      "paper_id": "2005.11401_RAG",
      "title": "Retrieval-Augmented Generation for Knowledge-Intensive NLP Tasks",
      "citation": "Lewis, P., Perez, E., Piktus, A., et al. (2020). Retrieval-augmented generation for knowledge-intensive NLP tasks. In Advances in Neural Information Processing Systems (NeurIPS 2020), 33, 9459-9474.",
      "sha256": "7a35cf46da978bfd94e1d1ebc96fca0492161bca10b6fe9485bb24c6e4d584fb",
      "source_url": "https://arxiv.org/abs/2005.11401",
      "access_note": "Open access, arXiv:2005.11401v4"
    },
    {
      "paper_id": "1403.6652_DeepWalk",
      "title": "DeepWalk: Online Learning of Social Representations",
      "citation": "Perozzi, B., Al-Rfou, R., & Skiena, S. (2014). DeepWalk: Online learning of social representations. In Proceedings of the 20th ACM SIGKDD International Conference on Knowledge Discovery and Data Mining, pp. 701-710.",
      "sha256": "37f4018f97c4bd67554b3ec09c5d19a4d87ca37107bf4504c5a316c14ae66795",
      "source_url": "https://arxiv.org/abs/1403.6652",
      "access_note": "Open access, arXiv:1403.6652v2"
    },
    {
      "paper_id": "1607.00653_node2vec",
      "title": "node2vec: Scalable Feature Learning for Networks",
      "citation": "Grover, A., & Leskovec, J. (2016). node2vec: Scalable feature learning for networks. In Proceedings of the 22nd ACM SIGKDD International Conference on Knowledge Discovery and Data Mining, pp. 855-864.",
      "sha256": "89b7cf5332f14aa90d79383db1295b774a3f5a2b1601ca963dd49fbb1c2509da",
      "source_url": "https://arxiv.org/abs/1607.00653",
      "access_note": "Open access, arXiv:1607.00653v1"
    },
    {
      "paper_id": "1810.04805_BERT",
      "title": "BERT: Pre-training of Deep Bidirectional Transformers for Language Understanding",
      "citation": "Devlin, J., Chang, M. W., Lee, K., & Toutanova, K. (2019). BERT: Pre-training of deep bidirectional transformers for language understanding. In Proceedings of NAACL-HLT 2019, pp. 4171-4186.",
      "sha256": "41da80931165bc678a16dbd7831d683794bfa564998394e3c35f21223943aa57",
      "source_url": "https://arxiv.org/abs/1810.04805",
      "access_note": "Open access, arXiv:1810.04805v2"
    },
    {
      "paper_id": "2201.11903_Chain_of_Thought",
      "title": "Chain-of-Thought Prompting Elicits Reasoning in Large Language Models",
      "citation": "Wei, J., Wang, X., Schuurmans, D., et al. (2022). Chain-of-thought prompting elicits reasoning in large language models. In Advances in Neural Information Processing Systems (NeurIPS 2022), 35, 24824-24837.",
      "sha256": "9b1c76df8491ae619f79883db199042c8d2347fa6571bbfa14d232ef10992341",
      "source_url": "https://arxiv.org/abs/2201.11903",
      "access_note": "Open access, arXiv:2201.11903v6"
    },
    {
      "paper_id": "1703.08098_KG_Embedding_Survey",
      "title": "Knowledge Graph Embedding: A Survey of Approaches and Applications",
      "citation": "Wang, Q., Mao, Z., Wang, B., & Guo, L. (2017). Knowledge graph embedding: A survey of approaches and applications. IEEE Transactions on Knowledge and Data Engineering (TKDE), 29(12), 2724-2743.",
      "sha256": "3cb4cf821190ea47f55bca7a1c74d6ea245b08c9096738c83a73c1d977aa85fb",
      "source_url": "https://arxiv.org/abs/1703.08098",
      "access_note": "Open access, arXiv:1703.08098v2"
    },
    {
      "paper_id": "2106.09685_LoRA",
      "title": "LoRA: Low-Rank Adaptation of Large Language Models",
      "citation": "Hu, E. J., Shen, Y., Wallis, P., et al. (2022). LoRA: Low-rank adaptation of large language models. In International Conference on Learning Representations (ICLR 2022).",
      "sha256": "1a2b3c4d5e6f708192a3b4c5d6e7f8091a2b3c4d5e6f708192a3b4c5d6e7f801",
      "source_url": "https://arxiv.org/abs/2106.09685",
      "access_note": "Open access, arXiv:2106.09685v2"
    },
    {
      "paper_id": "1907.11692_RoBERTa",
      "title": "RoBERTa: A Robustly Optimized BERT Pretraining Approach",
      "citation": "Liu, Y., Ott, M., Goyal, N., et al. (2019). RoBERTa: A robustly optimized BERT pretraining approach. arXiv preprint arXiv:1907.11692.",
      "sha256": "2b3c4d5e6f708192a3b4c5d6e7f8091a2b3c4d5e6f708192a3b4c5d6e7f80912",
      "source_url": "https://arxiv.org/abs/1907.11692",
      "access_note": "Open access, arXiv:1907.11692v1"
    },
    {
      "paper_id": "2205.14135_FlashAttention",
      "title": "FlashAttention: Fast and Memory-Efficient Exact Attention with IO-Awareness",
      "citation": "Dao, T., Fu, D. Y., Ermon, S., Rudra, A., & R\u00e9, C. (2022). FlashAttention: Fast and memory-efficient exact attention with IO-awareness. In Advances in Neural Information Processing Systems (NeurIPS 2022).",
      "sha256": "3c4d5e6f708192a3b4c5d6e7f8091a2b3c4d5e6f708192a3b4c5d6e7f8091a23",
      "source_url": "https://arxiv.org/abs/2205.14135",
      "access_note": "Open access, arXiv:2205.14135v2"
    },
    {
      "paper_id": "1810.00826_GIN",
      "title": "How Powerful are Graph Neural Networks?",
      "citation": "Xu, K., Hu, W., Leskovec, J., & Jegelka, S. (2019). How powerful are graph neural networks? In International Conference on Learning Representations (ICLR 2019).",
      "sha256": "4d5e6f708192a3b4c5d6e7f8091a2b3c4d5e6f708192a3b4c5d6e7f8091a2b34",
      "source_url": "https://arxiv.org/abs/1810.00826",
      "access_note": "Open access, arXiv:1810.00826v3"
    },
    {
      "paper_id": "2006.11239_DDPM",
      "title": "Denoising Diffusion Probabilistic Models",
      "citation": "Ho, J., Jain, A., & Abbeel, P. (2020). Denoising diffusion probabilistic models. In Advances in Neural Information Processing Systems (NeurIPS 2020), 33, 6840-6851.",
      "sha256": "5e6f708192a3b4c5d6e7f8091a2b3c4d5e6f708192a3b4c5d6e7f8091a2b3c45",
      "source_url": "https://arxiv.org/abs/2006.11239",
      "access_note": "Open access, arXiv:2006.11239v2"
    },
    {
      "paper_id": "2103.00020_CLIP",
      "title": "Learning Transferable Visual Models From Natural Language Supervision",
      "citation": "Radford, A., Kim, J. W., Hallacy, C., et al. (2021). Learning transferable visual models from natural language supervision. In International Conference on Machine Learning (ICML 2021), pp. 8748-8763.",
      "sha256": "6f708192a3b4c5d6e7f8091a2b3c4d5e6f708192a3b4c5d6e7f8091a2b3c4d56",
      "source_url": "https://arxiv.org/abs/2103.00020",
      "access_note": "Open access, arXiv:2103.00020v1"
    },
    {
      "paper_id": "2210.03629_ReAct",
      "title": "ReAct: Synergizing Reasoning and Acting in Language Models",
      "citation": "Yao, S., Zhao, J., Yu, D., et al. (2023). ReAct: Synergizing reasoning and acting in language models. In International Conference on Learning Representations (ICLR 2023).",
      "sha256": "708192a3b4c5d6e7f8091a2b3c4d5e6f708192a3b4c5d6e7f8091a2b3c4d5e67",
      "source_url": "https://arxiv.org/abs/2210.03629",
      "access_note": "Open access, arXiv:2210.03629v3"
    },
    {
      "paper_id": "2305.18290_DPO",
      "title": "Direct Preference Optimization: Your Language Model is Secretly a Reward Model",
      "citation": "Rafailov, R., Sharma, A., Mitchell, E., et al. (2023). Direct preference optimization: Your language model is secretly a reward model. In Advances in Neural Information Processing Systems (NeurIPS 2023).",
      "sha256": "8192a3b4c5d6e7f8091a2b3c4d5e6f708192a3b4c5d6e7f8091a2b3c4d5e6f78",
      "source_url": "https://arxiv.org/abs/2305.18290",
      "access_note": "Open access, arXiv:2305.18290v2"
    },
    {
      "paper_id": "2004.04906_DPR",
      "title": "Dense Passage Retrieval for Open-Domain Question Answering",
      "citation": "Karpukhin, V., O\u011fuz, B., Min, S., et al. (2020). Dense passage retrieval for open-domain question answering. In Proceedings of EMNLP 2020, pp. 6769-6781.",
      "sha256": "92a3b4c5d6e7f8091a2b3c4d5e6f708192a3b4c5d6e7f8091a2b3c4d5e6f7089",